{
  "name": "Magias",
  "schemaVersion": 2,
  "catalogVersion": 5,
  "sourceRepository": "KindermanBarros/solidao-dos-oprimidos",
  "sourceDocument": "50 Exemplos de Magias",
  "ruleReference": "03 - Regras/Magia/50 Exemplos de Magias.md",
  "abilities": [
    {
      "id": "magic.faisca_condutora",
      "type": "MAGIC",
      "name": "Faísca Condutora",
      "source": "Conhecimento",
      "knowledge": "Electromancia",
      "level": 1,
      "costType": "Arcano",
      "costValue": 2,
      "execution": "Ação",
      "range": "Curto",
      "targetArea": "3 m",
      "duration": "Turnos",
      "durationValue": 1,
      "resistance": "Arcana",
      "effect": "1d6 + POD elétrico em um alvo; pode desregular mecanismo simples por um turno.",
      "prerequisites": [
        "Electromancia nível 1"
      ],
      "keywords": [
        "Faísca Condutora",
        "Electromancia",
        "Nível 1",
        "Magia"
      ],
      "limit": "Sem limite adicional.",
      "activationCondition": "Executar como ação e gastar 2 ponto(s) de Arcano.",
      "enhancements": "Nenhum aprimoramento catalogado.",
      "deactivationCondition": "Após 1 turno(s).",
      "sourceDocument": "50 Exemplos de Magias",
      "ruleReference": "03 - Regras/Magia/50 Exemplos de Magias.md"
    },
    {
      "id": "magic.impulso_acelerado",
      "type": "MAGIC",
      "name": "Impulso Acelerado",
      "source": "Conhecimento",
      "knowledge": "Electromancia",
      "level": 2,
      "costType": "Arcano",
      "costValue": 3,
      "execution": "Ação",
      "range": "Pessoal",
      "targetArea": "pessoal",
      "duration": "Cena",
      "resistance": "Nenhuma",
      "effect": "Movimento adicional de 5 m e +2 na próxima Iniciativa ou Reflexos na cena.",
      "prerequisites": [
        "Electromancia nível 2"
      ],
      "keywords": [
        "Impulso Acelerado",
        "Electromancia",
        "Nível 2",
        "Magia"
      ],
      "limit": "Sem limite adicional.",
      "activationCondition": "Executar como ação e gastar 3 ponto(s) de Arcano.",
      "enhancements": "Nenhum aprimoramento catalogado.",
      "deactivationCondition": "Ao final da cena.",
      "sourceDocument": "50 Exemplos de Magias",
      "ruleReference": "03 - Regras/Magia/50 Exemplos de Magias.md"
    },
    {
      "id": "magic.punho_pedra",
      "type": "MAGIC",
      "name": "Punho de Pedra",
      "source": "Conhecimento",
      "knowledge": "Litomancia",
      "level": 1,
      "costType": "Arcano",
      "costValue": 1,
      "execution": "Ação",
      "range": "Pessoal",
      "targetArea": "pessoal",
      "duration": "Instantânea",
      "resistance": "Nenhuma",
      "effect": "Próximo ataque desarmado causa +1d6 físico e pode empurrar 1 m.",
      "prerequisites": [
        "Litomancia nível 1"
      ],
      "keywords": [
        "Punho de Pedra",
        "Litomancia",
        "Nível 1",
        "Magia"
      ],
      "limit": "Sem limite adicional.",
      "activationCondition": "Executar como ação e gastar 1 ponto(s) de Arcano.",
      "enhancements": "Nenhum aprimoramento catalogado.",
      "deactivationCondition": "Após resolver o efeito.",
      "sourceDocument": "50 Exemplos de Magias",
      "ruleReference": "03 - Regras/Magia/50 Exemplos de Magias.md"
    },
    {
      "id": "magic.muro_improvisado",
      "type": "MAGIC",
      "name": "Muro Improvisado",
      "source": "Conhecimento",
      "knowledge": "Litomancia",
      "level": 2,
      "costType": "Arcano",
      "costValue": 4,
      "execution": "Ação",
      "range": "Curto",
      "targetArea": "8 m",
      "duration": "Cena",
      "resistance": "Nenhuma",
      "effect": "Ergue cobertura alta de pedra com 15 Vida por uma cena.",
      "prerequisites": [
        "Litomancia nível 2"
      ],
      "keywords": [
        "Muro Improvisado",
        "Litomancia",
        "Nível 2",
        "Magia"
      ],
      "limit": "Sem limite adicional.",
      "activationCondition": "Executar como ação e gastar 4 ponto(s) de Arcano.",
      "enhancements": "Nenhum aprimoramento catalogado.",
      "deactivationCondition": "Ao final da cena.",
      "sourceDocument": "50 Exemplos de Magias",
      "ruleReference": "03 - Regras/Magia/50 Exemplos de Magias.md"
    },
    {
      "id": "magic.vinha_prendedora",
      "type": "MAGIC",
      "name": "Vinha Prendedora",
      "source": "Conhecimento",
      "knowledge": "Natureza",
      "level": 1,
      "costType": "Arcano",
      "costValue": 2,
      "execution": "Ação",
      "range": "Curto",
      "targetArea": "8 m",
      "duration": "Instantânea",
      "resistance": "Geral",
      "effect": "Imobiliza; escapar exige uma ação e FOR + Atletismo, CD 12.",
      "prerequisites": [
        "Natureza nível 1"
      ],
      "keywords": [
        "Vinha Prendedora",
        "Natureza",
        "Nível 1",
        "Magia"
      ],
      "limit": "Sem limite adicional.",
      "activationCondition": "Executar como ação e gastar 2 ponto(s) de Arcano.",
      "enhancements": "Nenhum aprimoramento catalogado.",
      "deactivationCondition": "Após resolver o efeito.",
      "sourceDocument": "50 Exemplos de Magias",
      "ruleReference": "03 - Regras/Magia/50 Exemplos de Magias.md"
    },
    {
      "id": "magic.sussurro_fauna",
      "type": "MAGIC",
      "name": "Sussurro da Fauna",
      "source": "Conhecimento",
      "knowledge": "Natureza",
      "level": 2,
      "costType": "Arcano",
      "costValue": 3,
      "execution": "Ação",
      "range": "Médio",
      "targetArea": "20 m",
      "duration": "Cena",
      "resistance": "Nenhuma",
      "effect": "Pequenos animais observam, distraem ou carregam objeto leve por uma cena.",
      "prerequisites": [
        "Natureza nível 2"
      ],
      "keywords": [
        "Sussurro da Fauna",
        "Natureza",
        "Nível 2",
        "Magia"
      ],
      "limit": "Sem limite adicional.",
      "activationCondition": "Executar como ação e gastar 3 ponto(s) de Arcano.",
      "enhancements": "Nenhum aprimoramento catalogado.",
      "deactivationCondition": "Ao final da cena.",
      "sourceDocument": "50 Exemplos de Magias",
      "ruleReference": "03 - Regras/Magia/50 Exemplos de Magias.md"
    },
    {
      "id": "magic.chama_palma",
      "type": "MAGIC",
      "name": "Chama na Palma",
      "source": "Conhecimento",
      "knowledge": "Piromancia",
      "level": 1,
      "costType": "Arcano",
      "costValue": 1,
      "execution": "Ação",
      "range": "Pessoal",
      "targetArea": "pessoal",
      "duration": "Cena",
      "resistance": "Nenhuma",
      "effect": "Luz e ignição por uma cena; toque ofensivo causa 1d6 + POD.",
      "prerequisites": [
        "Piromancia nível 1"
      ],
      "keywords": [
        "Chama na Palma",
        "Piromancia",
        "Nível 1",
        "Magia"
      ],
      "limit": "Sem limite adicional.",
      "activationCondition": "Executar como ação e gastar 1 ponto(s) de Arcano.",
      "enhancements": "Nenhum aprimoramento catalogado.",
      "deactivationCondition": "Ao final da cena.",
      "sourceDocument": "50 Exemplos de Magias",
      "ruleReference": "03 - Regras/Magia/50 Exemplos de Magias.md"
    },
    {
      "id": "magic.rajada_brasas",
      "type": "MAGIC",
      "name": "Rajada de Brasas",
      "source": "Conhecimento",
      "knowledge": "Piromancia",
      "level": 2,
      "costType": "Arcano",
      "costValue": 4,
      "execution": "Ação",
      "range": "Curto",
      "targetArea": "cone 5 m",
      "duration": "Tempo",
      "durationValue": 1,
      "durationUnit": "Dias",
      "resistance": "Arcana",
      "effect": "2d6 + POD de fogo; materiais inflamáveis podem incendiar.",
      "prerequisites": [
        "Piromancia nível 2"
      ],
      "keywords": [
        "Rajada de Brasas",
        "Piromancia",
        "Nível 2",
        "Magia"
      ],
      "limit": "Sem limite adicional.",
      "activationCondition": "Executar como ação e gastar 4 ponto(s) de Arcano.",
      "enhancements": "Nenhum aprimoramento catalogado.",
      "deactivationCondition": "Após 1 dias.",
      "sourceDocument": "50 Exemplos de Magias",
      "ruleReference": "03 - Regras/Magia/50 Exemplos de Magias.md"
    },
    {
      "id": "magic.jato_cortante",
      "type": "MAGIC",
      "name": "Jato Cortante",
      "source": "Conhecimento",
      "knowledge": "Aqueomancia",
      "level": 1,
      "costType": "Arcano",
      "costValue": 2,
      "execution": "Ação",
      "range": "Curto",
      "targetArea": "8 m",
      "duration": "Instantânea",
      "resistance": "Geral",
      "effect": "1d6 + POD físico; empurra alvo leve 1 m.",
      "prerequisites": [
        "Aqueomancia nível 1"
      ],
      "keywords": [
        "Jato Cortante",
        "Aqueomancia",
        "Nível 1",
        "Magia"
      ],
      "limit": "Sem limite adicional.",
      "activationCondition": "Executar como ação e gastar 2 ponto(s) de Arcano.",
      "enhancements": "Nenhum aprimoramento catalogado.",
      "deactivationCondition": "Após resolver o efeito.",
      "sourceDocument": "50 Exemplos de Magias",
      "ruleReference": "03 - Regras/Magia/50 Exemplos de Magias.md"
    },
    {
      "id": "magic.nevoa_cega",
      "type": "MAGIC",
      "name": "Névoa Cega",
      "source": "Conhecimento",
      "knowledge": "Aqueomancia",
      "level": 2,
      "costType": "Arcano",
      "costValue": 3,
      "execution": "Ação",
      "range": "Médio",
      "targetArea": "área 3 m a 10 m",
      "duration": "Turnos",
      "durationValue": 1,
      "resistance": "Nenhuma",
      "effect": "Nuvem por uma rodada; visão através dela impõe Cego.",
      "prerequisites": [
        "Aqueomancia nível 2"
      ],
      "keywords": [
        "Névoa Cega",
        "Aqueomancia",
        "Nível 2",
        "Magia"
      ],
      "limit": "Sem limite adicional.",
      "activationCondition": "Executar como ação e gastar 3 ponto(s) de Arcano.",